{
  "id": "extract",
  "title": "pages.extract.title",
  "summary": "pages.extract.summary",
  "sections": [
    {
      "id": "extract-inputs",
      "title": "sections.extract.extract-inputs.title",
      "controls": [
        {
          "id": "bam_path",
          "label": "controls.extract.extract-inputs.bam_path.label",
          "kind": "path",
          "tooltip": "controls.extract.extract-inputs.bam_path.tooltip"
        },
        {
          "id": "extract_region",
          "label": "controls.extract.extract-inputs.extract_region.label",
          "kind": "text",
          "placeholder": "controls.extract.extract-inputs.extract_region.placeholder",
          "tooltip": "controls.extract.extract-inputs.extract_region.tooltip"
        },
        {
          "id": "extract_extra",
          "label": "controls.extract.extract-inputs.extract_extra.label",
          "kind": "text",
          "placeholder": "controls.extract.extract-inputs.extract_extra.placeholder",
          "tooltip": "controls.extract.extract-inputs.extract_extra.tooltip"
        }
      ],
      "actions": [
        {
          "id": "mito-fasta",
          "title": "actions.extract.extract-inputs.mito-fasta.title",
          "tooltip": "actions.extract.extract-inputs.mito-fasta.tooltip",
          "command": {
            "executable": "wgse",
            "arguments": [
              "extract",
              "mito-fasta",
              "{{bam_path}}"
            ]
          }
        },
        {
          "id": "mt-bam",
          "title": "actions.extract.extract-inputs.mt-bam.title",
          "tooltip": "actions.extract.extract-inputs.mt-bam.tooltip",
          "command": {
            "executable": "wgse",
            "arguments": [
              "extract",
              "mt-bam",
              "{{bam_path}}"
            ]
          }
        },
        {
          "id": "mito-vcf",
          "title": "actions.extract.extract-inputs.mito-vcf.title",
          "tooltip": "actions.extract.extract-inputs.mito-vcf.tooltip",
          "command": {
            "executable": "wgse",
            "arguments": [
              "extract",
              "mito-vcf",
              "{{bam_path}}"
            ]
          }
        },
        {
          "id": "ydna-bam",
          "title": "actions.extract.extract-inputs.ydna-bam.title",
          "tooltip": "actions.extract.extract-inputs.ydna-bam.tooltip",
          "command": {
            "executable": "wgse",
            "arguments": [
              "extract",
              "ydna-bam",
              "{{bam_path}}"
            ]
          }
        },
        {
          "id": "ydna-vcf",
          "title": "actions.extract.extract-inputs.ydna-vcf.title",
          "tooltip": "actions.extract.extract-inputs.ydna-vcf.tooltip",
          "command": {
            "executable": "wgse",
            "arguments": [
              "extract",
              "ydna-vcf",
              "{{bam_path}}"
            ]
          }
        },
        {
          "id": "y-mt-extract",
          "title": "actions.extract.extract-inputs.y-mt-extract.title",
          "tooltip": "actions.extract.extract-inputs.y-mt-extract.tooltip",
          "command": {
            "executable": "wgse",
            "arguments": [
              "extract",
              "y-mt-extract",
              "{{bam_path}}"
            ]
          }
        },
        {
          "id": "bam-subset",
          "title": "actions.extract.extract-inputs.bam-subset.title",
          "tooltip": "actions.extract.extract-inputs.bam-subset.tooltip",
          "command": {
            "executable": "wgse",
            "arguments": [
              "extract",
              "bam-subset",
              "{{bam_path}}",
              "{{extract_extra}}"
            ]
          }
        },
        {
          "id": "unmapped",
          "title": "actions.extract.extract-inputs.unmapped.title",
          "tooltip": "actions.extract.extract-inputs.unmapped.tooltip",
          "command": {
            "executable": "wgse",
            "arguments": [
              "extract",
              "unmapped",
              "{{bam_path}}"
            ]
          }
        },
        {
          "id": "custom",
          "title": "actions.extract.extract-inputs.custom.title",
          "tooltip": "actions.extract.extract-inputs.custom.tooltip",
          "command": {
            "executable": "wgse",
            "arguments": [
              "extract",
              "custom",
              "{{bam_path}}",
              "--region",
              "{{extract_region}}",
              "{{extract_extra}}"
            ]
          }
        }
      ]
    }
  ],
  "iconName": "scissors"
}
