{
  "id": "workflow",
  "title": "pages.workflow.title",
  "summary": "pages.workflow.summary",
  "sections": [
    {
      "id": "workflow-overview",
      "title": "sections.workflow.workflow-overview.title",
      "subtitle": "sections.workflow.workflow-overview.subtitle",
      "controls": [
        {
          "id": "workflow-steps",
          "label": "controls.workflow.workflow-overview.workflow-steps.label",
          "kind": "infoGrid",
          "options": [
            {
              "id": "raw",
              "title": "options.workflow.workflow-overview.workflow-steps.raw.title"
            },
            {
              "id": "bam",
              "title": "options.workflow.workflow-overview.workflow-steps.bam.title"
            },
            {
              "id": "extract",
              "title": "options.workflow.workflow-overview.workflow-steps.extract.title"
            },
            {
              "id": "vcf",
              "title": "options.workflow.workflow-overview.workflow-steps.vcf.title"
            },
            {
              "id": "reports",
              "title": "options.workflow.workflow-overview.workflow-steps.reports.title"
            }
          ]
        }
      ],
      "iconName": "map"
    }
  ],
  "iconName": "list.bullet.rectangle"
}
