{
  "id": "microarray",
  "title": "pages.microarray.title",
  "summary": "pages.microarray.summary",
  "sections": [
    {
      "id": "microarray-inputs",
      "title": "sections.microarray.microarray-inputs.title",
      "controls": [
        {
          "id": "bam_path",
          "label": "controls.microarray.microarray-inputs.bam_path.label",
          "kind": "path",
          "tooltip": "controls.microarray.microarray-inputs.bam_path.tooltip"
        },
        {
          "id": "ref_path",
          "label": "controls.microarray.microarray-inputs.ref_path.label",
          "kind": "path",
          "tooltip": "controls.microarray.microarray-inputs.ref_path.tooltip"
        },
        {
          "id": "out_dir",
          "label": "controls.microarray.microarray-inputs.out_dir.label",
          "kind": "path",
          "tooltip": "controls.microarray.microarray-inputs.out_dir.tooltip"
        }
      ]
    },
    {
      "id": "microarray-formats",
      "title": "sections.microarray.microarray-formats.title",
      "controls": [
        {
          "id": "microarray_formats",
          "label": "controls.microarray.microarray-formats.microarray_formats.label",
          "kind": "checkboxGroup",
          "tooltip": "controls.microarray.microarray-formats.microarray_formats.tooltip",
          "options": [
            {
              "id": "combined-all",
              "title": "options.microarray.microarray-formats.microarray_formats.combined-all.title",
              "selected": true
            },
            {
              "id": "23andme-v3",
              "title": "options.microarray.microarray-formats.microarray_formats.23andme-v3.title"
            },
            {
              "id": "23andme-v4",
              "title": "options.microarray.microarray-formats.microarray_formats.23andme-v4.title"
            },
            {
              "id": "23andme-v5",
              "title": "options.microarray.microarray-formats.microarray_formats.23andme-v5.title",
              "selected": true
            },
            {
              "id": "23andme-v3-v5",
              "title": "options.microarray.microarray-formats.microarray_formats.23andme-v3-v5.title",
              "selected": true
            },
            {
              "id": "ancestry-v1",
              "title": "options.microarray.microarray-formats.microarray_formats.ancestry-v1.title"
            },
            {
              "id": "ancestry-v2",
              "title": "options.microarray.microarray-formats.microarray_formats.ancestry-v2.title"
            },
            {
              "id": "familytreedna-v2",
              "title": "options.microarray.microarray-formats.microarray_formats.familytreedna-v2.title"
            },
            {
              "id": "familytreedna-v3",
              "title": "options.microarray.microarray-formats.microarray_formats.familytreedna-v3.title"
            },
            {
              "id": "livingdna-v1",
              "title": "options.microarray.microarray-formats.microarray_formats.livingdna-v1.title"
            },
            {
              "id": "livingdna-v2",
              "title": "options.microarray.microarray-formats.microarray_formats.livingdna-v2.title"
            },
            {
              "id": "myheritage-v1",
              "title": "options.microarray.microarray-formats.microarray_formats.myheritage-v1.title"
            },
            {
              "id": "myheritage-v2",
              "title": "options.microarray.microarray-formats.microarray_formats.myheritage-v2.title"
            },
            {
              "id": "mthfr-genetics-uk",
              "title": "options.microarray.microarray-formats.microarray_formats.mthfr-genetics-uk.title"
            },
            {
              "id": "genera-br",
              "title": "options.microarray.microarray-formats.microarray_formats.genera-br.title"
            },
            {
              "id": "meudna-br",
              "title": "options.microarray.microarray-formats.microarray_formats.meudna-br.title"
            },
            {
              "id": "aadr-1240k",
              "title": "options.microarray.microarray-formats.microarray_formats.aadr-1240k.title"
            },
            {
              "id": "human-origins-v1",
              "title": "options.microarray.microarray-formats.microarray_formats.human-origins-v1.title"
            },
            {
              "id": "reich-combined",
              "title": "options.microarray.microarray-formats.microarray_formats.reich-combined.title"
            }
          ]
        }
      ],
      "actions": [
        {
          "id": "microarray-generate",
          "title": "actions.microarray.microarray-formats.microarray-generate.title",
          "tooltip": "actions.microarray.microarray-formats.microarray-generate.tooltip",
          "command": {
            "executable": "wgse",
            "arguments": [
              "microarray",
              "--input",
              "{{bam_path}}",
              "--ref",
              "{{ref_path}}",
              "--formats",
              "{{microarray_formats}}"
            ],
            "optionalArguments": [
              [
                "--outdir",
                "{{out_dir}}"
              ]
            ]
          }
        }
      ]
    }
  ],
  "iconName": "tablecells"
}
