{
  "id": "pet-analysis",
  "title": "pages.pet-analysis.title",
  "summary": "pages.pet-analysis.summary",
  "sections": [
    {
      "id": "pet-inputs",
      "title": "sections.pet-analysis.pet-inputs.title",
      "iconName": "pawprint",
      "controls": [
        {
          "id": "pet_species",
          "label": "controls.pet-analysis.pet-inputs.pet_species.label",
          "kind": "dropdown",
          "tooltip": "controls.pet-analysis.pet-inputs.pet_species.tooltip",
          "value": "dog",
          "options": [
            {
              "id": "dog",
              "title": "options.pet-analysis.pet-inputs.pet_species.dog.title"
            },
            {
              "id": "cat",
              "title": "options.pet-analysis.pet-inputs.pet_species.cat.title"
            }
          ]
        },
        {
          "id": "pet_fastq_r1",
          "label": "controls.pet-analysis.pet-inputs.pet_fastq_r1.label",
          "kind": "path",
          "tooltip": "controls.pet-analysis.pet-inputs.pet_fastq_r1.tooltip"
        },
        {
          "id": "pet_fastq_r2",
          "label": "controls.pet-analysis.pet-inputs.pet_fastq_r2.label",
          "kind": "path",
          "tooltip": "controls.pet-analysis.pet-inputs.pet_fastq_r2.tooltip"
        },
        {
          "id": "out_dir",
          "label": "controls.pet-analysis.pet-inputs.out_dir.label",
          "kind": "path",
          "tooltip": "controls.pet-analysis.pet-inputs.out_dir.tooltip"
        },
        {
          "id": "pet_output_format",
          "label": "controls.pet-analysis.pet-inputs.pet_output_format.label",
          "kind": "dropdown",
          "tooltip": "controls.pet-analysis.pet-inputs.pet_output_format.tooltip",
          "value": "BAM",
          "options": [
            {
              "id": "BAM",
              "title": "options.pet-analysis.pet-inputs.pet_output_format.BAM.title"
            },
            {
              "id": "CRAM",
              "title": "options.pet-analysis.pet-inputs.pet_output_format.CRAM.title"
            }
          ]
        }
      ],
      "actions": [
        {
          "id": "pet-align",
          "title": "actions.pet-analysis.pet-inputs.pet-align.title",
          "tooltip": "actions.pet-analysis.pet-inputs.pet-align.tooltip",
          "command": {
            "executable": "{{bundleRoot}}/scripts/run-wgsextract.sh",
            "arguments": [
              "pet-align",
              "--species",
              "{{pet_species}}",
              "--r1",
              "{{pet_fastq_r1}}",
              "--format",
              "{{pet_output_format}}"
            ],
            "optionalArguments": [
              [
                "--outdir",
                "{{out_dir}}"
              ],
              [
                "--r2",
                "{{pet_fastq_r2}}"
              ]
            ]
          }
        }
      ]
    }
  ],
  "iconName": "pawprint"
}
